{
  "acceptance_checks": [
    "cron+workflow_dispatchを持つレポート生成ワークフローが存在",
    "手動起動でreports/<日付>.mdが生成されreportsブランチにコミットされる",
    "reports/配下を丸ごとコミット(前方互換)",
    "既存pytestがgreen"
  ],
  "assigned_runtime": "claude-code",
  "dependencies": [],
  "expected_branch": "shiki/t-0004-daily-report-cron",
  "expected_pr": 6,
  "github_issue": 4,
  "goal_id": "G-0002",
  "id": "T-0004",
  "ledger_evidence": [
    "L-0013",
    "L-0014"
  ],
  "locks": [
    "path:.github/workflows/ossradar-daily-report.yml"
  ],
  "non_goals": [
    "スター増分集計(別Issue #5)",
    "main ブランチ保護の変更"
  ],
  "required_skills": [
    "tdd"
  ],
  "risk_level": "medium",
  "scope": "GitHub Actions のcron(毎日)+workflow_dispatch ワークフローで ossradar report を実行し、reports/配下を専用reportsブランチに耐久コミットする。mainには直接コミットしない。",
  "status": "review",
  "title": "日次レポートの自動生成(cron)とreportsブランチへの永続化"
}