{
  "acceptance_checks": [
    "\u540c\u65e5\u518d\u5b9f\u884c\u3092\u542b\u3080publish\u30ed\u30b8\u30c3\u30af\u304cCI\u76f8\u5f53\u306e\u4f7f\u3044\u6368\u3066git\u74b0\u5883\u3067\u6210\u529f\u3059\u308b",
    "workflow_dispatch\u672c\u756a\u8d77\u52d5\u304c\u6210\u529f\u3057reports\u30d6\u30e9\u30f3\u30c1\u306b\u30ec\u30dd\u30fc\u30c8\u3068data/\u30b9\u30ca\u30c3\u30d7\u30b7\u30e7\u30c3\u30c8\u304c\u6b8b\u308b"
  ],
  "assigned_runtime": "claude-code",
  "dependencies": [],
  "expected_branch": "shiki/t-0006-fix-report-publish",
  "expected_pr": null,
  "github_issue": 4,
  "goal_id": "G-0002",
  "id": "T-0006",
  "ledger_evidence": [
    "L-0017"
  ],
  "locks": [
    "path:.github/workflows/ossradar-daily-report.yml"
  ],
  "non_goals": [
    "\u30ec\u30dd\u30fc\u30c8\u5185\u5bb9/\u30c7\u30eb\u30bf\u30ed\u30b8\u30c3\u30af\u306e\u5909\u66f4"
  ],
  "required_skills": [
    "diagnose"
  ],
  "risk_level": "medium",
  "scope": ".github/workflows/ossradar-daily-report.yml \u306epublish\u30b9\u30c6\u30c3\u30d7\u3067\u3001reports\u30d6\u30e9\u30f3\u30c1\u5207\u66ff\u524d\u306b\u672a\u8ffd\u8de1\u306e\u751f\u6210\u7269\u3092\u6383\u9664\u3057\u3001\u540c\u65e5\u518d\u5b9f\u884c\u3084reports/data/\u8ffd\u52a0\u3067\u3082git switch\u304c\u885d\u7a81\u3057\u306a\u3044\u3088\u3046\u306b\u3059\u308b\u3002",
  "status": "planned",
  "title": "\u4fee\u5fa9: \u65e5\u6b21\u30ec\u30dd\u30fc\u30c8publish\u306e\u30d6\u30e9\u30f3\u30c1\u5207\u66ff\u885d\u7a81(\u540c\u65e5\u518d\u5b9f\u884c/\u30b9\u30ca\u30c3\u30d7\u30b7\u30e7\u30c3\u30c8)"
}
