{
  "acceptance_checks": [
    "reports/data/<日付>.jsonスナップショットが保存される",
    "直近過去スナップショットと比較しスター増分を算出",
    "Markdownレポートに増分表示",
    "過去データ無しはnew/—でクラッシュしない",
    "増分算出ロジックのpytestがgreen"
  ],
  "assigned_runtime": "claude-code",
  "dependencies": [],
  "expected_branch": "shiki/t-0005-star-delta",
  "expected_pr": 7,
  "github_issue": 5,
  "goal_id": "G-0002",
  "id": "T-0005",
  "ledger_evidence": [
    "L-0015",
    "L-0016"
  ],
  "locks": [
    "path:ossradar/*",
    "path:tests/*"
  ],
  "non_goals": [
    "cron/CI基盤の変更(T-0004で完了)"
  ],
  "required_skills": [
    "tdd"
  ],
  "risk_level": "low",
  "scope": "各レポート実行でreports/data/<日付>.jsonスナップショットを保存し、直近の過去スナップショットと比較してスター増分を算出、Markdownにデルタ列を表示。過去データ無しはnew/—。差分ロジックは純粋関数でTDD。",
  "status": "review",
  "title": "スター増分集計(前回比デルタ)をレポートに表示"
}