{
  "acceptance_checks": [
    "`python -m ossradar report` 実行で reports/<日付>.md が生成される",
    "レポートに上位N件のリポジトリ名・スター数・URLが含まれる",
    "APIレスポンスをモックして整形ロジックを検証するpytestがgreen"
  ],
  "assigned_runtime": "codex",
  "dependencies": [],
  "expected_branch": "shiki/t-0002-search-api-oss-n-markdown-1-cli",
  "expected_pr": 2,
  "github_issue": 1,
  "goal_id": "G-0002",
  "id": "T-0002",
  "ledger_evidence": [
    "L-0003",
    "L-0004",
    "L-0005",
    "L-0007",
    "L-0012"
  ],
  "locks": [
    "path:**/*"
  ],
  "non_goals": [],
  "required_skills": [
    "tdd"
  ],
  "risk_level": "low",
  "scope": "Python CLI 1本でGitHub Search APIを1回呼び出し、人気OSS上位N件(リポジトリ名/スター数/言語/説明/URL)を取得して reports/<日付>.md を生成する最小エンドツーエンド実装。httpx + pytest を使用。",
  "status": "review",
  "title": "最初の縦切り: Search APIから人気OSS上位N件を取得しMarkdownレポートを1ファイル生成するCLI"
}